{
  "$schema": "https://json-schema.org/draft/2020-12/schema",
  "$id": "urn:moirae:accord-02e4r4:effective-profile-manifest:0.2",
  "manifest_id": "urn:moirae:accord-02e4r4:effective-profile-manifest",
  "manifest_version": "0.2",
  "classification": {
    "semantic_domain": "effective-profile-domain schema",
    "frozen_identity": [
      "profile_type",
      "profile_version",
      "record_type",
      "contract_class",
      "status"
    ],
    "fixture_integrity": [
      "profile_path",
      "raw_sha256",
      "integrity_scope"
    ]
  },
  "profiles": [
    {
      "profile_type": "VALIDATION_RULE_PROFILE",
      "profile_id": "urn:moirae:accord-02r3:validation-rules:0.1",
      "profile_version": "0.1",
      "schema_id": "urn:moirae:accord-02e4r4:schema:effective-profile-domain:0.2",
      "schema_version": "0.2",
      "profile_path": "docs/accord-02/accord-02r3-validation-rules.json",
      "record_type": "VALIDATION_RULE_PROFILE",
      "selector": null,
      "overlay_contract_id": "urn:moirae:accord-02r5:validation-rules:0.1",
      "contract_class": "PROFILE",
      "status": "ACTIVE",
      "raw_sha256": "aa2cbd6c148e4ee9d48f67d526ba82a64cf1b996034a36fedb4726496de8a6cd",
      "integrity_scope": "RAW_BYTES"
    },
    {
      "profile_type": "VALIDATION_RULE_PROFILE",
      "profile_id": "urn:moirae:accord-02r5:validation-rules:0.1",
      "profile_version": "0.1",
      "schema_id": "urn:moirae:accord-02e4r4:schema:effective-profile-domain:0.2",
      "schema_version": "0.2",
      "profile_path": "docs/accord-02/accord-02r5-validation-rules.json",
      "record_type": "VALIDATION_RULE_PROFILE",
      "selector": null,
      "overlay_contract_id": null,
      "contract_class": "PROFILE",
      "status": "ACTIVE",
      "raw_sha256": "575203cb2bfe04534e86bdd656622169be50697b8cb7a99f4734dcda2b4a6996",
      "integrity_scope": "RAW_BYTES"
    },
    {
      "profile_type": "EXPERIMENT_PROFILE",
      "profile_id": "urn:moirae:accord-02d:experiment-profile",
      "profile_version": "0.2",
      "schema_id": "urn:moirae:accord-02e4r4:schema:effective-profile-domain:0.2",
      "schema_version": "0.2",
      "profile_path": "docs/accord-02/schema/accord-02d-experiment-profile.schema.json",
      "record_type": "EXPERIMENT_PROFILE",
      "selector": null,
      "overlay_contract_id": null,
      "contract_class": "PROFILE",
      "status": "ACTIVE",
      "raw_sha256": "ca49b87d6160e083ef0a2c793cbca3448316493ef4bb59db9932186a2979a43a",
      "integrity_scope": "RAW_BYTES"
    },
    {
      "profile_type": "VERIFIER_PROFILE",
      "profile_id": "urn:moirae:accord-02r5:verifier:default:0.1",
      "profile_version": "0.1",
      "schema_id": "urn:moirae:accord-02e4r4:schema:effective-profile-domain:0.2",
      "schema_version": "0.2",
      "profile_path": "docs/accord-02/schema/accord-02r5-verifier-profile.schema.json",
      "record_type": "VERIFIER_PROFILE",
      "selector": null,
      "overlay_contract_id": null,
      "contract_class": "PROFILE",
      "status": "ACTIVE",
      "raw_sha256": "13ee1769adf9221d329f3b6f44ee8f27a85b078701520ada6fc6b6158b4df9ae",
      "integrity_scope": "RAW_BYTES"
    },
    {
      "profile_type": "TRUST_ROOT_PROFILE",
      "profile_id": "urn:moirae:accord-02a:trust-root:fixture-v1",
      "profile_version": "0.1",
      "schema_id": "urn:moirae:accord-02e4r4:schema:effective-profile-domain:0.2",
      "schema_version": "0.2",
      "profile_path": "docs/accord-02/schema/accord-02r5-trust-root-profile.schema.json",
      "record_type": "TRUST_ROOT_PROFILE",
      "selector": null,
      "overlay_contract_id": null,
      "contract_class": "PROFILE",
      "status": "ACTIVE",
      "raw_sha256": "9327c65521dc656bea1a01548a180f1a594f8f623ac667c38c7b1293389aa52c",
      "integrity_scope": "RAW_BYTES"
    },
    {
      "profile_type": "AUTHORITY_PROFILE",
      "profile_id": "urn:moirae:accord-02b:closed-set-static-v1",
      "profile_version": "1.0",
      "schema_id": "urn:moirae:accord-02e4r4:schema:effective-profile-domain:0.2",
      "schema_version": "0.2",
      "profile_path": "docs/accord-02/examples/accord-02b-authority-test-vectors.json",
      "record_type": "AUTHORITY_PROFILE",
      "selector": "urn:moirae:accord-02b:closed-set-static-v1",
      "overlay_contract_id": null,
      "contract_class": "PROFILE",
      "status": "ACTIVE",
      "raw_sha256": "5a384f2d7510265fb1df82d5e44b179ea8d40713ace598d2609ed25d5d14a56e",
      "integrity_scope": "RAW_BYTES"
    },
    {
      "profile_type": "AUTHORITY_PROFILE",
      "profile_id": "urn:moirae:accord-02b:disjoint-union-v1",
      "profile_version": "1.0",
      "schema_id": "urn:moirae:accord-02e4r4:schema:effective-profile-domain:0.2",
      "schema_version": "0.2",
      "profile_path": "docs/accord-02/examples/accord-02b-authority-test-vectors.json",
      "record_type": "AUTHORITY_PROFILE",
      "selector": "urn:moirae:accord-02b:disjoint-union-v1",
      "overlay_contract_id": null,
      "contract_class": "PROFILE",
      "status": "ACTIVE",
      "raw_sha256": "5a384f2d7510265fb1df82d5e44b179ea8d40713ace598d2609ed25d5d14a56e",
      "integrity_scope": "RAW_BYTES"
    },
    {
      "profile_type": "AUTHORITY_PROFILE",
      "profile_id": "urn:moirae:accord-02b:shared-pool-v1",
      "profile_version": "1.0",
      "schema_id": "urn:moirae:accord-02e4r4:schema:effective-profile-domain:0.2",
      "schema_version": "0.2",
      "profile_path": "docs/accord-02/examples/accord-02b-authority-test-vectors.json",
      "record_type": "AUTHORITY_PROFILE",
      "selector": "urn:moirae:accord-02b:shared-pool-v1",
      "overlay_contract_id": null,
      "contract_class": "PROFILE",
      "status": "ACTIVE",
      "raw_sha256": "5a384f2d7510265fb1df82d5e44b179ea8d40713ace598d2609ed25d5d14a56e",
      "integrity_scope": "RAW_BYTES"
    },
    {
      "profile_type": "AUTHORITY_PROFILE",
      "profile_id": "urn:moirae:accord-02b:reserved-suballocation-v1",
      "profile_version": "1.0",
      "schema_id": "urn:moirae:accord-02e4r4:schema:effective-profile-domain:0.2",
      "schema_version": "0.2",
      "profile_path": "docs/accord-02/examples/accord-02b-authority-test-vectors.json",
      "record_type": "AUTHORITY_PROFILE",
      "selector": "urn:moirae:accord-02b:reserved-suballocation-v1",
      "overlay_contract_id": null,
      "contract_class": "PROFILE",
      "status": "ACTIVE",
      "raw_sha256": "5a384f2d7510265fb1df82d5e44b179ea8d40713ace598d2609ed25d5d14a56e",
      "integrity_scope": "RAW_BYTES"
    },
    {
      "profile_type": "AUTHORITY_PROFILE",
      "profile_id": "urn:moirae:accord-02b:mediated-analysis-v1",
      "profile_version": "1.0",
      "schema_id": "urn:moirae:accord-02e4r4:schema:effective-profile-domain:0.2",
      "schema_version": "0.2",
      "profile_path": "docs/accord-02/examples/accord-02b-authority-test-vectors.json",
      "record_type": "AUTHORITY_PROFILE",
      "selector": "urn:moirae:accord-02b:mediated-analysis-v1",
      "overlay_contract_id": null,
      "contract_class": "PROFILE",
      "status": "ACTIVE",
      "raw_sha256": "5a384f2d7510265fb1df82d5e44b179ea8d40713ace598d2609ed25d5d14a56e",
      "integrity_scope": "RAW_BYTES"
    },
    {
      "profile_type": "AUTHORITY_PROFILE",
      "profile_id": "urn:moirae:accord-02b:event-time-v1",
      "profile_version": "1.0",
      "schema_id": "urn:moirae:accord-02e4r4:schema:effective-profile-domain:0.2",
      "schema_version": "0.2",
      "profile_path": "docs/accord-02/examples/accord-02b-authority-test-vectors.json",
      "record_type": "AUTHORITY_PROFILE",
      "selector": "urn:moirae:accord-02b:event-time-v1",
      "overlay_contract_id": null,
      "contract_class": "PROFILE",
      "status": "ACTIVE",
      "raw_sha256": "5a384f2d7510265fb1df82d5e44b179ea8d40713ace598d2609ed25d5d14a56e",
      "integrity_scope": "RAW_BYTES"
    },
    {
      "profile_type": "AUTHORITY_PROFILE",
      "profile_id": "urn:moirae:accord-02b:workflow-unknown-v1",
      "profile_version": "1.0",
      "schema_id": "urn:moirae:accord-02e4r4:schema:effective-profile-domain:0.2",
      "schema_version": "0.2",
      "profile_path": "docs/accord-02/examples/accord-02b-authority-test-vectors.json",
      "record_type": "AUTHORITY_PROFILE",
      "selector": "urn:accord:02b:workflow-unknown-v1",
      "overlay_contract_id": null,
      "contract_class": "PROFILE",
      "status": "ACTIVE",
      "raw_sha256": "5a384f2d7510265fb1df82d5e44b179ea8d40713ace598d2609ed25d5d14a56e",
      "integrity_scope": "RAW_BYTES"
    },
    {
      "profile_type": "AUTHORITY_PROFILE",
      "profile_id": "urn:moirae:accord-02b:explicit-inheritance-v1",
      "profile_version": "1.0",
      "schema_id": "urn:moirae:accord-02e4r4:schema:effective-profile-domain:0.2",
      "schema_version": "0.2",
      "profile_path": "docs/accord-02/examples/accord-02b-authority-test-vectors.json",
      "record_type": "AUTHORITY_PROFILE",
      "selector": "urn:moirae:accord-02b:explicit-inheritance-v1",
      "overlay_contract_id": null,
      "contract_class": "PROFILE",
      "status": "ACTIVE",
      "raw_sha256": "5a384f2d7510265fb1df82d5e44b179ea8d40713ace598d2609ed25d5d14a56e",
      "integrity_scope": "RAW_BYTES"
    },
    {
      "profile_type": "AUTHORITY_PROFILE",
      "profile_id": "urn:moirae:accord-02b:comparison-required-v1",
      "profile_version": "1.0",
      "schema_id": "urn:moirae:accord-02e4r4:schema:effective-profile-domain:0.2",
      "schema_version": "0.2",
      "profile_path": "docs/accord-02/examples/accord-02b-authority-test-vectors.json",
      "record_type": "AUTHORITY_PROFILE",
      "selector": "urn:moirae:accord-02b:comparison-required-v1",
      "overlay_contract_id": null,
      "contract_class": "PROFILE",
      "status": "ACTIVE",
      "raw_sha256": "5a384f2d7510265fb1df82d5e44b179ea8d40713ace598d2609ed25d5d14a56e",
      "integrity_scope": "RAW_BYTES"
    },
    {